root@lamp-ubuntu-s-1vcpu-1gb-tor1-01:~# tcpdump -A -i eth0
tcpdump: verbose output suppressed, use -v[v]... for full protocol decode
listening on eth0, link-type EN10MB (Ethernet), snapshot length 262144 bytes
05:43:10.277403 IP lamp-ubuntu-s-1vcpu-1gb-tor1-01.ssh > 198.211.111.194.36055: Flags [P.], seq 1202249431:1202249495, ack 768128741, win 501, options [nop,nop,TS val 3588021007 ecr 1476539895], length 64
E..t.#@.@.[N..$...o.....G...-........h.....
....X.5...U.../10.Vc..w...A|...t..t.(/K....v..$$.Q....M5.t.`..-D|....-.s
05:43:10.278973 IP lamp-ubuntu-s-1vcpu-1gb-tor1-01.ssh > 198.211.111.194.36055: Flags [P.], seq 64:192, ack 1, win 501, options [nop,nop,TS val 3588021008 ecr 1476539895], length 128
E....$@.@.[...$...o.....G...-..............
....X.5.....--6.%M.!....z..+O.......@......7...{JM...~XS.8......v;.......w
.......3.....-......G......5..mL......e...6...Ghm-tKlZ.....V.
05:43:10.279036 IP lamp-ubuntu-s-1vcpu-1gb-tor1-01.ssh > 198.211.111.194.36055: Flags [P.], seq 192:256, ack 1, win 501, options [nop,nop,TS val 3588021008 ecr 1476539895], length 64
E..t.%@.@.[L..$...o.....G...-........h.....
....X.5.I].P&:..:9{.1..?.~.z../............>.b..6.R(..rY3b.B...%8)...C..
05:43:10.279079 IP lamp-ubuntu-s-1vcpu-1gb-tor1-01.ssh > 198.211.111.194.36055: Flags [P.], seq 256:336, ack 1, win 501, options [nop,nop,TS val 3588021008 ecr 1476539895], length 80
E....&@.@.[;..$...o.....G...-........x.....
....X.5.9.5G..2.Q...d..T.?x..........d.rW.v......P.*..(.        .O..m.z.d...C/Z.....%...68.....
05:43:10.279125 IP lamp-ubuntu-s-1vcpu-1gb-tor1-01.ssh > 198.211.111.194.36055: Flags [P.], seq 336:416, ack 1, win 501, options [nop,nop,TS val 3588021008 ecr 1476539895], length 80
E....'@.@.[:..$...o.....G..'-........x.....
....X.5....r....{.....".3vn..Q.....Oa...~dW.b.; ...h....8th(.tE...w.,..%...d..Z..h.].0..
05:43:10.279165 IP lamp-ubuntu-s-1vcpu-1gb-tor1-01.ssh > 198.211.111.194.36055: Flags [P.], seq 416:496, ack 1, win 501, options [nop,nop,TS val 3588021009 ecr 1476539895], length 80
E....(@.@.[9..$...o.....G..w-........x.....
....X.5..S...n....C..........].....L....=.......~u.K.l  ...h......ziQFkc.
...0...p.Jz$1.m
05:43:10.279201 IP lamp-ubuntu-s-1vcpu-1gb-tor1-01.ssh > 198.211.111.194.36055: Flags [P.], seq 496:560, ack 1, win 501, options [nop,nop,TS val 3588021009 ecr 1476539895], length 64
E..t.)@.@.[H..$...o.....G...-........h.....
....X.5..6s.,.@y....9>..q.l. ..c.
9.....nO.:^..3.Y...aB.1(!R.d..S..y...m
05:43:10.292148 IP 198.211.111.194.36055 > lamp-ubuntu-s-1vcpu-1gb-tor1-01.ssh: Flags [.], ack 64, win 580, options [nop,nop,TS val 1476539915 ecr 3588021007], length 0
E..4..@.5.j...o...$.....-...G......D.!.....
X.6.....
05:43:10.293499 IP 198.211.111.194.36055 > lamp-ubuntu-s-1vcpu-1gb-tor1-01.ssh: Flags [.], ack 192, win 580, options [nop,nop,TS val 1476539917 ecr 3588021008], length 0
E..4..@.5.j...o...$.....-...G......D.......
X.6.....
05:43:10.293567 IP 198.211.111.194.36055 > lamp-ubuntu-s-1vcpu-1gb-tor1-01.ssh: Flags [.], ack 256, win 580, options [nop,nop,TS val 1476539917 ecr 3588021008], length 0
E..4..@.5.j...o...$.....-...G......D.^.....
X.6.....
05:43:10.293567 IP 198.211.111.194.36055 > lamp-ubuntu-s-1vcpu-1gb-tor1-01.ssh: Flags [.], ack 336, win 580, options [nop,nop,TS val 1476539917 ecr 3588021008], length 0
E..4..@.5.j...o...$.....-...G..'...D.......
X.6.....
05:43:10.293609 IP 198.211.111.194.36055 > lamp-ubuntu-s-1vcpu-1gb-tor1-01.ssh: Flags [.], ack 416, win 580, options [nop,nop,TS val 1476539917 ecr 3588021008], length 0
E..4..@.5.j...o...$.....-...G..w...D.......
X.6.....
05:43:10.293682 IP 198.211.111.194.36055 > lamp-ubuntu-s-1vcpu-1gb-tor1-01.ssh: Flags [.], ack 496, win 580, options [nop,nop,TS val 1476539917 ecr 3588021009], length 0
E..4..@.5.j...o...$.....-...G......D.m.....
X.6.....
05:43:10.293708 IP 198.211.111.194.36055 > lamp-ubuntu-s-1vcpu-1gb-tor1-01.ssh: Flags [.], ack 560, win 580, options [nop,nop,TS val 1476539917 ecr 3588021009], length 0
E..4..@.5.i...o...$.....-...G......D.-.....
X.6.....
05:43:10.376901 IP lamp-ubuntu-s-1vcpu-1gb-tor1-01.41325 > 67.207.67.2.domain: 13372+ [1au] PTR? 194.111.211.198.in-addr.arpa. (57)
E..Uy...@..v..$.C.C..m.5.AK.4<...........194.111.211.198.in-addr.arpa.......)........
05:43:10.377033 IP lamp-ubuntu-s-1vcpu-1gb-tor1-01.58259 > 67.207.67.2.domain: 47282+ [1au] PTR? 194.111.211.198.in-addr.arpa. (57)
E..U....@.....$.C.C....5.AK..............194.111.211.198.in-addr.arpa.......)........
05:43:10.377089 IP lamp-ubuntu-s-1vcpu-1gb-tor1-01.52582 > 67.207.67.2.domain: Flags [S], seq 3899808196, win 64240, options [mss 1460,sackOK,TS val 3113754041 ecr 0,nop,wscale 7,tfo  cookiereq,nop,nop], length 0
E..@..@.@.\...$.C.C..f.5.rY.........Kp.........
............"...
05:43:10.379080 IP 67.207.67.2.domain > lamp-ubuntu-s-1vcpu-1gb-tor1-01.41325: 13372 NXDomain 0/1/1 (124)
E.......<.>hC.C...$..5.m....4<...........194.111.211.198.in-addr.arpa..............@.7.ns1.digitalocean.com.
hostmaster..Y..l..*0.....       :.......)........
05:43:10.379081 IP 67.207.67.2.domain > lamp-ubuntu-s-1vcpu-1gb-tor1-01.58259: 47282 NXDomain 0/1/1 (124)
E.......<.>gC.C...$..5...................194.111.211.198.in-addr.arpa..............@.7.ns1.digitalocean.com.
hostmaster..Y..l..*0.....       :.......)........
05:43:10.379340 IP lamp-ubuntu-s-1vcpu-1gb-tor1-01.41325 > 67.207.67.2.domain: 13372+ PTR? 194.111.211.198.in-addr.arpa. (46)
E..Jy...@.....$.C.C..m.5.6K.4<...........194.111.211.198.in-addr.arpa.....
05:43:10.379389 IP lamp-ubuntu-s-1vcpu-1gb-tor1-01.58259 > 67.207.67.2.domain: 47282+ PTR? 194.111.211.198.in-addr.arpa. (46)
E..J....@.....$.C.C....5.6K..............194.111.211.198.in-addr.arpa.....
05:43:10.379476 IP 67.207.67.2.domain > lamp-ubuntu-s-1vcpu-1gb-tor1-01.52582: Flags [S.], seq 3011969752, ack 3899808197, win 65160, options [mss 1460,sackOK,TS val 1309178846 ecr 3113754041,nop,wscale 9], length 0
E..<..@.<..~C.C...$..5.f.....rY................
N.{........
05:43:10.379535 IP lamp-ubuntu-s-1vcpu-1gb-tor1-01.52582 > 67.207.67.2.domain: Flags [.], ack 1, win 502, options [nop,nop,TS val 3113754044 ecr 1309178846], length 0
E..4..@.@.\...$.C.C..f.5.rY.........Kd.....
....N.{.
05:43:10.379585 IP lamp-ubuntu-s-1vcpu-1gb-tor1-01.52582 > 67.207.67.2.domain: Flags [P.], seq 1:49, ack 1, win 502, options [nop,nop,TS val 3113754044 ecr 1309178846], length 48 53240+ PTR? 194.111.211.198.in-addr.arpa. (46)
E..d..@.@.\...$.C.C..f.5.rY.........K......
....N.{................194.111.211.198.in-addr.arpa.....
05:43:10.380373 IP 67.207.67.2.domain > lamp-ubuntu-s-1vcpu-1gb-tor1-01.41325: 13372 NXDomain 0/1/0 (113)
E.......<.>qC.C...$..5.m.y..4<...........194.111.211.198.in-addr.arpa..............@.7.ns1.digitalocean.com.
hostmaster..Y..l..*0.....       :.....
05:43:10.380484 IP 67.207.67.2.domain > lamp-ubuntu-s-1vcpu-1gb-tor1-01.58259: 47282 NXDomain 0/1/0 (113)
E.......<.>pC.C...$..5...y.H.............194.111.211.198.in-addr.arpa..............@.7.ns1.digitalocean.com.
hostmaster..Y..l..*0.....       :.....
05:43:10.380576 IP 67.207.67.2.domain > lamp-ubuntu-s-1vcpu-1gb-tor1-01.52582: Flags [.], ack 49, win 128, options [nop,nop,TS val 1309178847 ecr 3113754044], length 0
E..4a&@.<..`C.C...$..5.f.....rY......^.....
N.{.....
05:43:10.380833 IP 67.207.67.2.domain > lamp-ubuntu-s-1vcpu-1gb-tor1-01.52582: Flags [P.], seq 1:116, ack 49, win 128, options [nop,nop,TS val 1309178847 ecr 3113754044], length 115 53240 NXDomain 0/1/0 (113)
E...a'@.<...C.C...$..5.f.....rY............
N.{......q.............194.111.211.198.in-addr.arpa..............@.7.ns1.digitalocean.com.
hostmaster..Y..l..*0.....       :.....
05:43:10.380853 IP lamp-ubuntu-s-1vcpu-1gb-tor1-01.52582 > 67.207.67.2.domain: Flags [.], ack 116, win 502, options [nop,nop,TS val 3113754045 ecr 1309178847], length 0
E..4..@.@.\...$.C.C..f.5.rY....L....Kd.....
....N.{.
05:43:10.381532 IP lamp-ubuntu-s-1vcpu-1gb-tor1-01.56560 > 67.207.67.2.domain: 43849+ [1au] PTR? 161.36.203.159.in-addr.arpa. (56)
E..T.J..@.A...$.C.C....5.@K..I...........161.36.203.159.in-addr.arpa.......)........
05:43:10.382613 IP 67.207.67.2.domain > lamp-ubuntu-s-1vcpu-1gb-tor1-01.56560: 43849 NXDomain 0/1/1 (123)
E....T..<./.C.C...$..5.......I...........161.36.203.159.in-addr.arpa..............@.7.ns1.digitalocean.com.
hostmaster..g..L..*0.....       :.......)........
05:43:10.382695 IP lamp-ubuntu-s-1vcpu-1gb-tor1-01.56560 > 67.207.67.2.domain: 43849+ PTR? 161.36.203.159.in-addr.arpa. (45)
E..I.K..@.A...$.C.C....5.5K..I...........161.36.203.159.in-addr.arpa.....
05:43:10.383706 IP 67.207.67.2.domain > lamp-ubuntu-s-1vcpu-1gb-tor1-01.56560: 43849 NXDomain 0/1/0 (112)
E....U..<./.C.C...$..5...x?..I...........161.36.203.159.in-addr.arpa..............@.7.ns1.digitalocean.com.
hostmaster..g..L..*0.....       :.....
05:43:10.384328 IP lamp-ubuntu-s-1vcpu-1gb-tor1-01.ssh > 198.211.111.194.36055: Flags [P.], seq 560:816, ack 1, win 501, options [nop,nop,TS val 3588021114 ecr 1476539917], length 256
E..4.*@.@.Z...$...o.....G...-........(.....
...zX.6..-V.Yx....%.P..,;q(#vY*..M.Z*|.....X"Re..g.-R4.n..iSR.f.....|.$........c*.?.P1....;a......N...i..lW...:..x.C.d...K;9..5I.........5.1.D.>.@..7&...Y.`~H(............q\..0..0*.(f../.\yUv..6.hgt@4.
..(6.G.
.G....l.d5<..'2.v.'s...Cx@B y.=F1.....7..O3..N..g...0I
05:43:10.384461 IP lamp-ubuntu-s-1vcpu-1gb-tor1-01.ssh > 198.211.111.194.36055: Flags [P.], seq 816:976, ack 1, win 501, options [nop,nop,TS val 3588021114 ecr 1476539917], length 160
E....+@.@.Z...$...o.....G...-..............
...zX.6.......K[K.......e.<..s......3d.q..Q...V.._.v......o.b......':...6.."._f.W.....n!.`-..........$..,a..o....7.oQ..?:.a.j..Dq.....$T.9..L.|.....]...]%.(x...0F....,.
05:43:10.384544 IP lamp-ubuntu-s-1vcpu-1gb-tor1-01.ssh > 198.211.111.194.36055: Flags [P.], seq 976:1040, ack 1, win 501, options [nop,nop,TS val 3588021114 ecr 1476539917], length 64
E..t.,@.@.[E..$...o.....G...-........h.....
...zX.6...3.../..r..Bq...z..m.>.G[.q..R'.0L.q.f.M..v.Q........{T.....   .O
05:43:10.384633 IP lamp-ubuntu-s-1vcpu-1gb-tor1-01.ssh > 198.211.111.194.36055: Flags [P.], seq 1040:1168, ack 1, win 501, options [nop,nop,TS val 3588021114 ecr 1476539917], length 128
E....-@.@.[...$...o.....G...-..............
...zX.6.hNgl.
.W>....
.......G'.....N.m...8%A.9.r..i.........5.@.F..7.@..0..P...............k+..O.FR@5(.Qn..oF9G. 6..D.R..SU..\...f...<.
05:43:10.384751 IP lamp-ubuntu-s-1vcpu-1gb-tor1-01.ssh > 198.211.111.194.36055: Flags [P.], seq 1168:1232, ack 1, win 501, options [nop,nop,TS val 3588021114 ecr 1476539917], length 64
E..t..@.@.[C..$...o.....G..g-........h.....
...zX.6.s..m.HGF..9i..'V......,HK...x...{....:..~..Y?.[...."x.......b...
05:43:10.384838 IP lamp-ubuntu-s-1vcpu-1gb-tor1-01.ssh > 198.211.111.194.36055: Flags [P.], seq 1232:1472, ack 1, win 501, options [nop,nop,TS val 3588021114 ecr 1476539917], length 240
E..$./@.@.Z...$...o.....G...-..............
...zX.6..R..M=cG.       ..:\.......!.....;...dZ.|.q.1T.3....,-...{=..0=......xi'....-.x4....Eq.*..G...8o.....l..).|k_.;..sci..........x....,d.t?8...S./H6..l.,....?..6.h.....L...@*..0..
.._B..U.=....Y.......4O.].;s3]..<...a.q.... ..W.. .N.
\.oY..{=.$.....
05:43:10.384898 IP lamp-ubuntu-s-1vcpu-1gb-tor1-01.ssh > 198.211.111.194.36055: Flags [P.], seq 1472:1536, ack 1, win 501, options [nop,nop,TS val 3588021114 ecr 1476539917], length 64
E..t.0@.@.[A..$...o.....G...-........h.....
...zX.6.iuP...X... ....
.2]...y..P      q.
]....`.p....E...Q..i..E.Y4....v."@
05:43:10.384952 IP lamp-ubuntu-s-1vcpu-1gb-tor1-01.ssh > 198.211.111.194.36055: Flags [P.], seq 1536:1632, ack 1, win 501, options [nop,nop,TS val 3588021114 ecr 1476539917], length 96
E....1@.@.[ ..$...o.....G...-..............
...zX.6.pZ=].j.P.{K.T..+xk.......c.4u}w...R9..=.".M..u....U..jTwUS......M8#.;\.p...+=k].        .Y...1......./f
05:43:10.384992 IP lamp-ubuntu-s-1vcpu-1gb-tor1-01.ssh > 198.211.111.194.36055: Flags [P.], seq 1632:1696, ack 1, win 501, options [nop,nop,TS val 3588021114 ecr 1476539917], length 64
E..t.2@.@.[?..$...o.....G..7-........h.....
...zX.6..I..........Is.s|.s!$..&3r./.Ep.3...bG_.G....k.v7..E#..FEX..p...
05:43:10.385040 IP lamp-ubuntu-s-1vcpu-1gb-tor1-01.ssh > 198.211.111.194.36055: Flags [P.], seq 1696:1824, ack 1, win 501, options [nop,nop,TS val 3588021114 ecr 1476539917], length 128
E....3@.@.Z...$...o.....G..w-..............
...zX.6...o*..sp        ..D...a.*...8.....1.}"<>l..nB...)..=......T...$..t.<..sdD^..^.5.&..q...-..&...,O.v.....A,...x,.1...:`.....%...I%..T....
05:43:10.385079 IP lamp-ubuntu-s-1vcpu-1gb-tor1-01.ssh > 198.211.111.194.36055: Flags [P.], seq 1824:1888, ack 1, win 501, options [nop,nop,TS val 3588021114 ecr 1476539917], length 64
E..t.4@.@.[=..$...o.....G...-........h.....
...zX.6...*.N.3...C.q.2.M,.wK......-D+...w.1Z.].....V..:..o..h.A......B.
05:43:10.385124 IP lamp-ubuntu-s-1vcpu-1gb-tor1-01.ssh > 198.211.111.194.36055: Flags [P.], seq 1888:2000, ack 1, win 501, options [nop,nop,TS val 3588021114 ecr 1476539917], length 112
E....5@.@.[...$...o.....G..7-..............
...zX.6....!........v......U
.^....RT.....#.7..X..G...W.Q3|*.t.:#...#.A...1...2"..y.-y..|....O..?.}loT.J'..Ui .IB.u...o.
05:43:10.385201 IP lamp-ubuntu-s-1vcpu-1gb-tor1-01.ssh > 198.211.111.194.36055: Flags [P.], seq 2000:2304, ack 1, win 501, options [nop,nop,TS val 3588021115 ecr 1476539917], length 304
E..d.6@.@.ZK..$...o.....G...-........X.....
...{X.6.....x}4.].C/yH@.L.......0.....$2+.....K.~!.r.X.B/.k...._.
........w.|.Z......>.....d......<q.U....F....zvD".A...s.P........Ih....mR.._P|4..W0....B.BcVe|P.lG..!......h[X.b...97.q.qRb.3u......p.YP_L...H:....T..8......
..eNo....Y.B\............5v....._.X...A.]V.. .\.f.I..d.;
.r....^.&.rB..\.7......].s`...t
05:43:10.385239 IP lamp-ubuntu-s-1vcpu-1gb-tor1-01.ssh > 198.211.111.194.36055: Flags [P.], seq 2304:2368, ack 1, win 501, options [nop,nop,TS val 3588021115 ecr 1476539917], length 64
E..t.7@.@.[:..$...o.....G...-........h.....
...{X.6.?.)...EZ..j...U....E@.....)ok.jy.ipk...P7.r......`.3.aKo..e..C..
05:43:10.399101 IP 198.211.111.194.36055 > lamp-ubuntu-s-1vcpu-1gb-tor1-01.ssh: Flags [.], ack 816, win 579, options [nop,nop,TS val 1476540022 ecr 3588021114], length 0
E..4..@.5.i...o...$.....-...G......C.\.....
X.6v...z
05:43:10.399102 IP 198.211.111.194.36055 > lamp-ubuntu-s-1vcpu-1gb-tor1-01.ssh: Flags [.], ack 976, win 578, options [nop,nop,TS val 1476540022 ecr 3588021114], length 0
E..4..@.5.i...o...$.....-...G......B.......
X.6v...z
05:43:10.399102 IP 198.211.111.194.36055 > lamp-ubuntu-s-1vcpu-1gb-tor1-01.ssh: Flags [.], ack 1040, win 578, options [nop,nop,TS val 1476540022 ecr 3588021114], length 0
E..4..@.5.i...o...$.....-...G......B.}.....
X.6v...z
05:43:10.399158 IP lamp-ubuntu-s-1vcpu-1gb-tor1-01.ssh > 198.211.111.194.36055: Flags [P.], seq 2368:5264, ack 1, win 501, options [nop,nop,TS val 3588021128 ecr 1476540022], length 2896
E....8@.@.P)..$...o.....G...-........y.....
....X.6vAh....0.l.l.F`f.-.bn..n./.:.6.u@...dW...~^...v.
\..^..,......|^.cl..=PS.xRv...Zt..z..m.)......?[......Z...}.'.V...az.9.F..0.0_k'..!1T?..W?...   .......9.XWY.]*..p...... @.G.QO<.......-...v._...8...i]0-.>....Lt.V+.....$B...Hm.'B.\..w,"...7...{.>..1..t}....>..].g
|...I.j%..?...#.J.E.-."[        .=.M..m}+L.G..\y.       ....<3.V..M6`.....g.k...M. ........]...><su...H.d....'.(.9..*....T.J'.}8.D..B..9g..J./l..F.).R......1^.O.id...6F.J'd....k.~....*t.......3(..Y....,.k.......<j.n.=5Mn..Rt.j..t........     ..m.....b..Y......h.".....l.....F.m......S.     .R.....b...........5.......g..`.p].&.........j...h}.LF....'...-.\.%.,.......JZ..#?B........KZj...U...+....q.M...k0*...^Vj...........7......tsz....+....{`g.......Z.W.gR3DZ..L.nDu.M...o.cb...iQ..<.'+`R...\. Z..<..].&M<P.7N.....O.+k.d..f.[....!.s.._k...~oZr
...;i.yw...P.j1.O8./..K.k..Enj.3S.x....8.       ...7T&2..>.>.S.#saz~L..jz....r........E*n.!W.......x...m2]..@..............z(.....x.A...1.="..n.A....f{PX..6.._`.....T3....U.........@e..ma..N-@..h......NB.{Q......}x.......d.......Q.6I..Z..NN...-y.w....*....2yE...!...u.QIc.%`5.t...[........CC ....'.?..S{.*.....R......N....*......?...*%:.........iFxq......=.......]cB...;f6......GMA.Y..q.....u.@|..L
~g..W..^.....o........J...je..r...[S_.?-.h.)F...N.Tr.em.K....#.o.r4.M..1#..[..'z...^B......k..;.XE.....D....q.. .1..ZG.v..MV..9....>....j...mU..Y.e.........`....F..=...W...p.>X...I`.....Y.[......Od;..N.wn.."A.>./..b.V........F...o........$.J..b...rP`WMe.W.Wl.k.f..l+).....;K.1....c@v.\..C...cRN8..!..K....x...g...x.. ...h...?.x..d..'?)e...UD.$;..?kxbBD].....\..W...b..........[..        ....~.p".u.."'.a......o...f.......@._.....U8...E.w.0k..... .Y.qe....)..i..UZ,..g.-.......f.Zz.l.....b..u...U@...aQX^.t.M..[6.[....`..C....9..9eL..W..7v .^%....g..Q...6....A._..y"...Eq.w..Y...."......v.6."%..9.....).....C..([...........:G.h..a[.&n...>.=9..+*........e3,.....=.U.(VW.......&.....\2........c..n...Os.K.C&....!..h..O..63..w..e........H.o.D.n.*_b....=......cx.9z..<z...w...<.k,-Q;Y....jQ9.....RFh.*..l.D....h...R.1...s..6...O.(}.6.e.'Qc#>_.....!ls*......Q7<../F......L{z........K.C^..[..wR......r+....1<9...I..m=...1.=.K.6..wd.G..m...m._J,.....2#..?.m.,.i..^.#.N.X..l........B..D=UV/S.0.h..!.. k.......        =....XlX.{..._J....}..dZ-..O..<..=.M.S.*!.......!.OQ...Vx.S....yX...7$..3].v..<..[......B....k.]g*......s...&/....|.3...W6.....=..:../.ec...WA2.......I.....;U.i..Ue.v.......o.0  &....>.....1...T...|.j.'o]...F.K/ro.....:...U;...W..R...^A.A......ok..o1...j....f.J~>..y....V.BH.q....(I.0..^@QL.... ..3.....|.z..tL..#.dGmYF..#$!.|h.aN_.B..,LF..........)>...sbK.2z..F.T.....0...1.4:.C..%P....;..t.fZz.. .........J...4...p..h.a)..V*.....2..vi....Q......nNV..U...7R'.8e.......Xt.@o...4.A.....K..b...F....ry.....0.Em..2k.%...I...p....$.43 .^..G..+.N.#..:Y....kD(...-..p......t%K/.s.WF}t?..[xC...~Ey......N..z.....P...G...I.s..    ...}...........%n.c.!.GQ..f./...`...R.9.?|%..w......V_P.Ii@..aq+.>:.2.:a.N......p        x<.O..u......n.C.h.!..p..
05:43:10.399190 IP lamp-ubuntu-s-1vcpu-1gb-tor1-01.ssh > 198.211.111.194.36055: Flags [P.], seq 5264:8160, ack 1, win 501, options [nop,nop,TS val 3588021129 ecr 1476540022], length 2896
E....:@.@.P'..$...o.....G..g-........y.....
....X.6v....\.q...(......[..#7y.v..Q.*.#._...............N.u........n.)o...e)...[..E.K...NMw..&j .`.y.u.b=g..L....L.....|.TH..Jy...J.......6...E.!W.....u(n'k29H..6....[.....&T..*k...LN....|*C.Yg..r........5..@.!!.........T..^.!.3z.:...>....n..!T]...u....,.%....a.E.0d..m..H.fV....Z...........?...~.i...P..D...[.S...F...zY#Q...Eq(Z...n.E>%C...C....-...al..R9s,..I....../.M..0....3.f.>s..?...iR.........-.......@.%f.^....../...u
...r..=.uN...$_........IU.F*|.D.G$..]...R..N.....n.d.....(e. .r.ey2.;... ...Lx..        .H.#&.i..g........As._0...Ob-T..`.....o.`^.G.q.....t.WP..}gY..@-......cL.S..z....K\(l.0... ...}S.....I...
.&[{.....+6...H...W...b..m..h...-       "..^"_.CU$(C.....Yw..Y..2c.\{.C.q.s.[.Zw.#....f..).Tx.+.=.....S.../....4.._BL9.g;...t6._&...A......^g....i$.B.*.6...!8LN.:xTK.WEY.V..*3...rV...s|+i.79Y..q..T....o.+C.9{<>.B|...Z...fb.w.n.)+...:@..........%..~..;L..E.r...`../...!i[....{......5p.......$O6.f}.3O.....yS.\.....s...F1..ba..8 ...YO...t.(tr...\.l..........J>{.x.e...N...
..d7....k.......0.(..c..h...g..u...6bk..#..@.]..y.5...h.l.s..UJ|...dG..%l...u.[.;8......A..(..<N....f.k.m.?.....Z..H.....l.<...552TW*.....(.j..mmY..Uf.<2>..     .G...Dq.5&,....`S.._........m..Mm.....I.......$=>5..&.. ...Q..w......Y1.`=..Ja.nO...L&z..".". ..R?....l....j.p.Et...o......Gv3MD...]..
......).....d.`...1[...;.6OW).. F=p......../niI.]wP..t~.(J.._.(*..........v...MT}MLY.r...O..g...?.4`xD..        C........[U...(.........Ft...Z,I...W1..U.. Y..   ......8.DSr6:A..%+.......`.e.10..[..&.r...gy...f...)..K....9.....h*.>.d.k..+....P.b.."...v.o.:+P.Fo^.3...O...u L.|%y5.b...5..b.)...Yj<(..W......a0..........i..h.c*..*.-[..C.}...O.K.[.....4..w...m./.=g.y........u..!}.3.$...Uw...(y-vA....5`. |...c..Y.n...2.E..v.SO^.\...N%....f....OH47.....#...{.}R...X...k..<.:..-...........;...40...\-=...4OV$..}.u........).9f.......b4M..:.....4...M....O..lO......f..OyQ...xg    ...)v   ..#.?....E.Ms.f.A.Xh...p..8.08.\..d6e...j.v...V.....?5.......z1....l.q..3I8.    .N`j/.6HHr...Y
.C>........<......A.2(..d`tG._s...K..{.@.........?#7..."...f..V.&NP.Vp...X."...f|..vm..s....dnu..5$j..E:.8.t....w..4w>....t..*m"/..#.R..../|a. .:'...q.a .....F...-k....e....!.9 ...E    u.c................Q...k.       .64H..ga.o.-..T.hl;&..k...}@C.*.L....<F.|..d;vN.......W^~...i....x...e....'."..+v...4.#.8.....
Z..]#R..O).........N@.sb.5.X.rB..9.^.;.I.2.C}.......g.......2.x.......&.r....E7....Tl.#...h...~s..o.5...f.WF...e...@L..E....E..f...W.Q.i.3q..V..e...9.-....l....4...NS..a......~..       .qT..T....?.._M....@.QdB.4..(V.......p8..9..]......yOzIN)..j,}.\t.....q:.J.......8m wT.N...#...L..G4t.B......0.!E.8.&.rn~....=X....{.].].Kq.WI.K....S..  :t^-.u............K.D....%...1#*n.s...6....9....O].6)..}
...[.g"u.......iP.......m.3."..r2W....{......D.m..B....<....^...1..#y*.=..Wx...w.P.......(j..bN,NG.....!..(.S......q.\....n;.=)......    l........1V
...#....$.0.....fY....[..6..:).a....|92.U x..F..p...U...G.@....z.k........i.#n.S.R.~.%.x.E.t.o[Dche.......d...g.TK{.....a..]......_.....M
05:43:10.399284 IP lamp-ubuntu-s-1vcpu-1gb-tor1-01.ssh > 198.211.111.194.36055: Flags [P.], seq 8160:9936, ack 1, win 501, options [nop,nop,TS val 3588021129 ecr 1476540022], length 1776
E..$.<@.@.T...$...o.....G...-..............
....X.6v......I..Q*6....-.7..1.~V=..O...J v.}.iR.D.8)B..z..VU.c.k......S..'...1i....@........js....4..Oy.D.C'A...jv....h..v....J.....U...........55..+..^J..~.Hy..2.........'X...~...8...gT.....@.0..]....Td...Xn.. .K. m<d>bb2b......k........|.e.@.....4.nO.{N..c.)......`....6Y0..]....^..\L   ..:m.2}{.'=.......... 7..a.!c.....T|.`},./..rv.M.d....*..U...G. ..vL....Z.n.Gu6.>.8..F....:.W].$);.(.|.D.....t....@}a].z.4...T4.o........(.[....'..v.    XX...3E...X@'i.b.....F<.......c.&Q...v5."...\4n........h..GP!..+...s5....X.7......Y...PT.......F..{.M.E........X&..2...,......7..L.......NR.....-....6W..W..u.k{....".....t...g...Q/.#d0Vn..<........k{.:..CGQ2m.U.~H.JT7U....*T..Y}.!Y:.
Rc.3.5.
...).%r..G.P...Z].R......pF..$..4.k(.....H.".W.r.D.y..=N.a7....6.--@.J..[.Rx.......y"R..l,....> ..I!.e.....&z..~.#....O......u.'c....N....c.. .p......YC4.....]. .}ej`V.9,.';..KR.s....;...w..\.5...N,..b....u.M....&.....G..d....g!.Z.
..=...:....r.x^`c........a...'....b...[.n.Q.....F......aO3..g.lr).....+..k...4...........r...........K.....c....,hE..!.p..|U....zw..&.3..b.cm....>.R).THn1.~.\./.&......R_..WO...C.]....L......wt......[a..p....7..w..a....E$1:.1AU...Yk.rT.f<....q.      -..&..$G.b....:..xi{.....,C...f'...-.....\..E..Q..Z=...?..]e}N....[}.y.B0 .|*.........PfX..6....n....3:....F..#.xQ.&6.#.g.....4......M..5.~....g>Q.~...O..A^e.n|.:...........    <\ W...G..K?.?....K{....a'N2.p.."..:Gt.3.....I.zGY.m.f...XF.......$..? Nt.U0*^..... ..P.B...E......*U;.jQ..a..|...<s...+......{.e..p..?...8......r.'.C......2.....4...].tt.v....}~<.s.p..MQ.l.............;.#90+*Z;..:.... M..iN1AI0..h.ap;N.>.,k...#.........[Q....Z.z    ...QKv..K..0R...F_L.DW...u~...)..c Z.L[g.?.d....y........!....W...Yz...>....5....,.....M....    ...]..w.0.C.]....2S>O<Wg.,p............y."..9..a....0....?........Z2.&..9.[....v.....C.X.}.Ua.28
05:43:10.399348 IP 198.211.111.194.36055 > lamp-ubuntu-s-1vcpu-1gb-tor1-01.ssh: Flags [.], ack 1168, win 577, options [nop,nop,TS val 1476540023 ecr 3588021114], length 0
E..4..@.5.i...o...$.....-...G..g...A.......
X.6w...z
05:43:10.399348 IP 198.211.111.194.36055 > lamp-ubuntu-s-1vcpu-1gb-tor1-01.ssh: Flags [.], ack 1232, win 577, options [nop,nop,TS val 1476540023 ecr 3588021114], length 0
E..4..@.5.i...o...$.....-...G......A.......
X.6w...z
05:43:10.399367 IP 198.211.111.194.36055 > lamp-ubuntu-s-1vcpu-1gb-tor1-01.ssh: Flags [.], ack 1472, win 576, options [nop,nop,TS val 1476540023 ecr 3588021114], length 0
E..4..@.5.i...o...$.....-...G......@.......
X.6w...z
05:43:10.399367 IP 198.211.111.194.36055 > lamp-ubuntu-s-1vcpu-1gb-tor1-01.ssh: Flags [.], ack 1536, win 576, options [nop,nop,TS val 1476540023 ecr 3588021114], length 0
E..4..@.5.i...o...$.....-...G......@.......
X.6w...z
05:43:10.399431 IP 198.211.111.194.36055 > lamp-ubuntu-s-1vcpu-1gb-tor1-01.ssh: Flags [.], ack 1632, win 576, options [nop,nop,TS val 1476540023 ecr 3588021114], length 0
E..4..@.5.i...o...$.....-...G..7...@.......
X.6w...z
05:43:10.399467 IP 198.211.111.194.36055 > lamp-ubuntu-s-1vcpu-1gb-tor1-01.ssh: Flags [.], ack 1696, win 576, options [nop,nop,TS val 1476540023 ecr 3588021114], length 0
E..4..@.5.i...o...$.....-...G..w...@.......
X.6w...z
05:43:10.402526 IP 198.211.111.194.36055 > lamp-ubuntu-s-1vcpu-1gb-tor1-01.ssh: Flags [.], ack 2368, win 580, options [nop,nop,TS val 1476540026 ecr 3588021114], length 0
E..4..@.5.i...o...$.....-...G......D.G.....
X.6z...z
05:43:10.413925 IP 198.211.111.194.36055 > lamp-ubuntu-s-1vcpu-1gb-tor1-01.ssh: Flags [.], ack 8160, win 552, options [nop,nop,TS val 1476540037 ecr 3588021128], length 0
E..4..@.5.i...o...$.....-...G......(.......
X.6.....
05:43:10.413991 IP 198.211.111.194.36055 > lamp-ubuntu-s-1vcpu-1gb-tor1-01.ssh: Flags [.], ack 9936, win 542, options [nop,nop,TS val 1476540037 ecr 3588021129], length 0
E..4..@.5.i...o...$.....-...G.......z......
X.6.....
^C
62 packets captured
121 packets received by filter
0 packets dropped by kernel