root@lamp-ubuntu-s-1vcpu-1gb-tor1-01:~# tcpdump -c 5 -i eth0
tcpdump: verbose output suppressed, use -v[v]... for full protocol decode
listening on eth0, link-type EN10MB (Ethernet), snapshot length 262144 bytes
05:40:28.889286 IP lamp-ubuntu-s-1vcpu-1gb-tor1-01.ssh > 198.211.111.194.36055: Flags [P.], seq 1200933367:1200933431, ack 768125157, win 501, options [nop,nop,TS val 3587859619 ecr 1476378507], length 64
05:40:28.890271 IP lamp-ubuntu-s-1vcpu-1gb-tor1-01.ssh > 198.211.111.194.36055: Flags [P.], seq 64:192, ack 1, win 501, options [nop,nop,TS val 3587859620 ecr 1476378507], length 128
05:40:28.890336 IP lamp-ubuntu-s-1vcpu-1gb-tor1-01.ssh > 198.211.111.194.36055: Flags [P.], seq 192:256, ack 1, win 501, options [nop,nop,TS val 3587859620 ecr 1476378507], length 64
05:40:28.890389 IP lamp-ubuntu-s-1vcpu-1gb-tor1-01.ssh > 198.211.111.194.36055: Flags [P.], seq 256:336, ack 1, win 501, options [nop,nop,TS val 3587859620 ecr 1476378507], length 80
05:40:28.890423 IP lamp-ubuntu-s-1vcpu-1gb-tor1-01.ssh > 198.211.111.194.36055: Flags [P.], seq 336:416, ack 1, win 501, options [nop,nop,TS val 3587859620 ecr 1476378507], length 80
5 packets captured
43 packets received by filter
0 packets dropped by kernel